{
  "verdict": "rejected",
  "engine_version": "dbisam-4-unknown-build",
  "captured_at": "2026-05-26T21:49:57Z",
  "rows_affected": null,
  "error_code": null,
  "error_message": "Expected column name but instead found code in SELECT SQL statement",
  "harness_reqcode": "0x2ead",
  "harness_response_bytes": null,
  "harness_table": null,
  "harness_catalog": "NISAINT_CS",
  "harness_code_a": 1,
  "harness_code_b": 8
}
