{
  "verdict": "rejected",
  "engine_version": "dbisam-4-unknown-build",
  "captured_at": "2026-05-26T21:49:56Z",
  "rows_affected": null,
  "error_code": null,
  "error_message": null,
  "harness_reqcode": "0x2b02",
  "harness_response_bytes": null,
  "harness_table": "no_such_table",
  "harness_catalog": null,
  "harness_code_a": null,
  "harness_code_b": null
}
