{
  "verdict": "rejected",
  "engine_version": "dbisam-4-unknown-build",
  "captured_at": "2026-05-27T15:06:21Z",
  "rows_affected": null,
  "error_code": null,
  "error_message": "Expected VALUES or SELECT but instead found \\ in INSERT SQL statement",
  "harness_reqcode": "0x2ead",
  "harness_response_bytes": null,
  "harness_table": null,
  "harness_catalog": "NISAINT_CS",
  "harness_code_a": 1,
  "harness_code_b": 52
}
